<?xml version = "1.0" encoding = "utf-8"?>
<!DOCTYPE salanb-configuration SYSTEM
        "http://johnsalguero.com/dtd/salanb-configuration-0.1.dtd">
<salanb-configuration>
    <session-factory>

        <property name = "driver_class">
            org.postgresql.Driver
        </property>

        <property name = "url">
            jdbc:mysql://localhost/test
        </property>

        <property name = "username">
            root
        </property>

        <property name = "password">
            root123
        </property>

        <!-- List of XML mapping files -->
        <mapping resource = "Movie.salanb.test.xml"/>
        <mapping resource = "UserAccounts.salanb.test.xml"/>

    </session-factory>
</salanb-configuration>